{
  "schemaVersion": 1,
  "world": "NorthAmerica",
  "gameBuild": "25677108",
  "units": "meters",
  "shape": "axis-aligned bounding box",
  "count": 213,
  "buildings": [
    {
      "id": "bef0d4fde5de",
      "kind": "bungalow",
      "class": "B_Residential_Bungalow_01_C",
      "min": [
        -4353.92,
        -4362.72,
        80.51
      ],
      "max": [
        -4332.76,
        -4341.08,
        90.28
      ],
      "parts": 48
    },
    {
      "id": "27dc76a185e0",
      "kind": "house",
      "class": "B_Residential_House_01_C",
      "min": [
        -4343.78,
        -4305.07,
        80.31
      ],
      "max": [
        -4322.27,
        -4285.05,
        93.58
      ],
      "parts": 67
    },
    {
      "id": "a0b124a454eb",
      "kind": "house",
      "class": "B_Residential_House_01_C",
      "min": [
        -4320.58,
        -4440.95,
        80.13
      ],
      "max": [
        -4299.36,
        -4421,
        93.4
      ],
      "parts": 67
    },
    {
      "id": "ab081925a4d7",
      "kind": "bungalow",
      "class": "B_Residential_Bungalow_01_C",
      "min": [
        -4237.31,
        -4245.32,
        80.31
      ],
      "max": [
        -4215.76,
        -4224.19,
        90.08
      ],
      "parts": 48
    },
    {
      "id": "1eefbbc15b38",
      "kind": "bungalow",
      "class": "B_Residential_Bungalow_01_C",
      "min": [
        -4237.14,
        -3519.25,
        76.72
      ],
      "max": [
        -4214.83,
        -3499.32,
        86.49
      ],
      "parts": 48
    },
    {
      "id": "18f8980c5264",
      "kind": "house",
      "class": "B_Residential_House_01_C",
      "min": [
        -4116.73,
        -4236.28,
        78.39
      ],
      "max": [
        -4096.83,
        -4215.25,
        91.66
      ],
      "parts": 67
    },
    {
      "id": "40ac82df3121",
      "kind": "bungalow",
      "class": "B_Residential_Bungalow_01_C",
      "min": [
        -4088.61,
        -4279.26,
        78.11
      ],
      "max": [
        -4069.05,
        -4257.37,
        87.88
      ],
      "parts": 48
    },
    {
      "id": "c0b20c877fb0",
      "kind": "bungalow",
      "class": "B_Residential_Bungalow_01_C",
      "min": [
        -3974.63,
        -4277.95,
        77.21
      ],
      "max": [
        -3953.37,
        -4256.94,
        86.98
      ],
      "parts": 48
    },
    {
      "id": "f19b4761ad49",
      "kind": "house",
      "class": "B_Residential_House_01_C",
      "min": [
        -3770.47,
        -4221.56,
        75.48
      ],
      "max": [
        -3749.27,
        -4201.62,
        88.75
      ],
      "parts": 67
    },
    {
      "id": "7b93fa14b3a2",
      "kind": "bungalow",
      "class": "B_Residential_Bungalow_01_C",
      "min": [
        -3765.67,
        -4077.76,
        75.09
      ],
      "max": [
        -3744.55,
        -4056.25,
        84.86
      ],
      "parts": 48
    },
    {
      "id": "9b79b5976407",
      "kind": "bungalow",
      "class": "B_Residential_Bungalow_01_C",
      "min": [
        -3731.43,
        -4134.87,
        75.06
      ],
      "max": [
        -3710.31,
        -4113.36,
        84.83
      ],
      "parts": 48
    },
    {
      "id": "690dd412b9c6",
      "kind": "house",
      "class": "B_Residential_House_01_C",
      "min": [
        -3708.22,
        -4019.24,
        75.13
      ],
      "max": [
        -3684.86,
        -4000.22,
        88.4
      ],
      "parts": 67
    },
    {
      "id": "78122ec63733",
      "kind": "house",
      "class": "B_Residential_House_01_C",
      "min": [
        -3699.66,
        -4115.4,
        74.56
      ],
      "max": [
        -3678.01,
        -4095.34,
        87.83
      ],
      "parts": 67
    },
    {
      "id": "8b38198eaf86",
      "kind": "bungalow",
      "class": "B_Residential_Bungalow_01_C",
      "min": [
        -3635.12,
        -4045.37,
        74.14
      ],
      "max": [
        -3618.34,
        -4026.59,
        83.91
      ],
      "parts": 48
    },
    {
      "id": "0f334a7f7718",
      "kind": "bungalow",
      "class": "B_Residential_Bungalow_01_C",
      "min": [
        -3627.33,
        -4425.17,
        76.96
      ],
      "max": [
        -3605.81,
        -4404.06,
        86.73
      ],
      "parts": 48
    },
    {
      "id": "3499871e4f52",
      "kind": "bungalow",
      "class": "B_Residential_Bungalow_01_C",
      "min": [
        -3565.18,
        -4038.65,
        73.15
      ],
      "max": [
        -3548.4,
        -4019.87,
        82.92
      ],
      "parts": 48
    },
    {
      "id": "45edaa1699ed",
      "kind": "bungalow",
      "class": "B_Residential_Bungalow_01_C",
      "min": [
        -3359.31,
        -3920.81,
        69.96
      ],
      "max": [
        -3337.78,
        -3899.69,
        79.73
      ],
      "parts": 48
    },
    {
      "id": "4f824985edcd",
      "kind": "bungalow",
      "class": "B_Residential_Bungalow_01_C",
      "min": [
        -3202.67,
        -4172.21,
        68.82
      ],
      "max": [
        -3181.48,
        -4150.47,
        78.59
      ],
      "parts": 48
    },
    {
      "id": "7801ad009e34",
      "kind": "house",
      "class": "B_Residential_House_01_C",
      "min": [
        -3081.65,
        -4369.57,
        66.29
      ],
      "max": [
        -3061.87,
        -4348.91,
        79.56
      ],
      "parts": 67
    },
    {
      "id": "d844ce9b3cea",
      "kind": "house",
      "class": "B_Residential_House_01_C",
      "min": [
        -1777.55,
        -674.81,
        75.25
      ],
      "max": [
        -1757.3,
        -651,
        88.52
      ],
      "parts": 67
    },
    {
      "id": "8db244c4cfd3",
      "kind": "garage",
      "class": "BP_Garage_Closed_02a_C",
      "min": [
        -1756.14,
        -673.65,
        76.2
      ],
      "max": [
        -1746.81,
        -663.35,
        79.8
      ],
      "parts": 2
    },
    {
      "id": "9646aa666428",
      "kind": "bungalow",
      "class": "B_Residential_Bungalow_03_C",
      "min": [
        -1713.94,
        -598.14,
        76.38
      ],
      "max": [
        -1696.86,
        -580.7,
        85.2
      ],
      "parts": 38
    },
    {
      "id": "86fd432d45d4",
      "kind": "warehouse",
      "class": "BP_Warehouse_Small_03a_C",
      "min": [
        -1634.21,
        -2023.46,
        74.78
      ],
      "max": [
        -1618.48,
        -2009.63,
        80.94
      ],
      "parts": 8
    },
    {
      "id": "d2a7f8b46190",
      "kind": "bungalow",
      "class": "B_Residential_Bungalow_03_C",
      "min": [
        -1626.55,
        426.56,
        75.8
      ],
      "max": [
        -1611.08,
        440.92,
        84.62
      ],
      "parts": 38
    },
    {
      "id": "0d03cee49012",
      "kind": "warehouse",
      "class": "B_Warehouse_02a_C",
      "min": [
        -1606.29,
        -2030.33,
        75.81
      ],
      "max": [
        -1576.65,
        -2005.19,
        83.91
      ],
      "parts": 13
    },
    {
      "id": "84b2d34e5e84",
      "kind": "bungalow",
      "class": "B_Residential_Bungalow_01_C",
      "min": [
        -1576.93,
        433.4,
        72.96
      ],
      "max": [
        -1555.14,
        454.61,
        82.73
      ],
      "parts": 48
    },
    {
      "id": "6cbe4f99f61f",
      "kind": "house",
      "class": "B_Residential_House_01_C",
      "min": [
        -1570.47,
        -2296.79,
        84.96
      ],
      "max": [
        -1550.52,
        -2277.29,
        98.23
      ],
      "parts": 67
    },
    {
      "id": "cad0e8a20932",
      "kind": "warehouse",
      "class": "BP_Warehouse_Small_03a_C",
      "min": [
        -1557.21,
        -1986.62,
        76.2
      ],
      "max": [
        -1541.48,
        -1972.79,
        82.36
      ],
      "parts": 8
    },
    {
      "id": "ca69546c2263",
      "kind": "house",
      "class": "B_Residential_House_01_C",
      "min": [
        -1556.36,
        404.58,
        72.24
      ],
      "max": [
        -1536.34,
        426.08,
        85.51
      ],
      "parts": 67
    },
    {
      "id": "1f5d1b08b1f1",
      "kind": "house",
      "class": "B_Residential_House_01_C",
      "min": [
        -1541.72,
        -2354.32,
        86.66
      ],
      "max": [
        -1521.94,
        -2334.89,
        99.93
      ],
      "parts": 67
    },
    {
      "id": "66bd899d0347",
      "kind": "bungalow",
      "class": "B_Residential_Bungalow_03_C",
      "min": [
        -1541.15,
        -2282.15,
        83.87
      ],
      "max": [
        -1524.44,
        -2265.96,
        92.69
      ],
      "parts": 38
    },
    {
      "id": "b6f632a9c9a5",
      "kind": "warehouse",
      "class": "BP_Warehouse_Small_03a_C",
      "min": [
        -1530.33,
        -2010.17,
        76.98
      ],
      "max": [
        -1516.57,
        -1994.46,
        83.14
      ],
      "parts": 8
    },
    {
      "id": "c56b17e99ed0",
      "kind": "garage",
      "class": "BP_Garage_Closed_02a_C",
      "min": [
        -1524.02,
        -2345.29,
        87.51
      ],
      "max": [
        -1515.82,
        -2335,
        91.1
      ],
      "parts": 2
    },
    {
      "id": "e4fcc26a22d8",
      "kind": "bungalow",
      "class": "B_Residential_Bungalow_03_C",
      "min": [
        -1515.54,
        -2344.6,
        86.55
      ],
      "max": [
        -1498.83,
        -2328.41,
        95.37
      ],
      "parts": 38
    },
    {
      "id": "da46db8b27ca",
      "kind": "garage",
      "class": "BP_Garage_Closed_02a_C",
      "min": [
        -1509.42,
        -2319.2,
        87.83
      ],
      "max": [
        -1501.23,
        -2308.91,
        91.42
      ],
      "parts": 2
    },
    {
      "id": "0628c57f407f",
      "kind": "bungalow",
      "class": "B_Residential_Bungalow_03_C",
      "min": [
        -1505.44,
        -2118.6,
        79.54
      ],
      "max": [
        -1489.24,